unique_identifier,employee_feedback,department,clean_employee_feedback,word_count
3565,There's a culture of blame within the company that makes it difficult to take ownership of mistakes and learn from them. When things go w,Dept A,there culture blame within company make difficult take ownership mistake learn thing go w,25
7323,"The company's approach to feedback and performance reviews is generally helpful, but I think there could be more opportunities for employees to provide feedback on their managers. This would help ensure that everyone is held accountable and that issues are addressed in a timely manner. Additionally, while the feedback provided during performance reviews is useful, it can be difficult to implement changes if the feedback is only provided once a year. More frequent check-ins and feedback opportunities would be beneficial for both employees and managers",Dept A,company approach feedback performance review generally helpful think could opportunity employee provide feedback manager would help ensure everyone held accountable issue addressed timely manner additionally feedback provided performance review useful difficult implement change feedback provided year frequent checkins feedback opportunity would beneficial employee manager,85
5008,"While page limits have been set, some departments are ignoring them and still having long minutes and fanciful slides for internal meetings i.e. not all bosses enforce the new work norms.",Dept A,page limit set department ignoring still long minute fanciful slide internal meeting ie boss enforce new work norm,31
2179,"The culture of collaboration within our team is truly something special. Everyone is willing to lend a hand when needed, and there's a real sense of camaraderie that makes coming to work a pleasure. It's clear that we all have a shared goal of producing high-quality work, and the support we give each other makes that possible.",Dept A,culture collaboration within team truly something special everyone willing lend hand needed there real sense camaraderie make coming work pleasure clear shared goal producing highquality work support give make possible,57
6830,"While the workload can be overwhelming at times, I appreciate that the company offers flexible work arrangements that allow me to maintain a healthy work-life balance. I just wish that the workload itself were more manageable.",Dept A,workload overwhelming time appreciate company offer flexible work arrangement allow maintain healthy worklife balance wish workload manageable,36
7594,"While the company offers competitive compensation, there are still some areas where more investment could be made. For example, I would like to see more investment in technology and other resources that could help employees be more efficient and productive.",Dept A,company offer competitive compensation still area investment could made example would like see investment technology resource could help employee efficient productive,40
7910,"While the company's benefits package is generally competitive, there are some areas where it falls short. Specifically, I would like to see more investment in mental health support and wellness initiatives. While the company offers mental health resources",Dept A,company benefit package generally competitive area fall short specifically would like see investment mental health support wellness initiative company offer mental health resource,38
5259,"We need to be clearer on our ultimate objective, and not just about appearing to be doing well",Dept A,need clearer ultimate objective appearing well,18
7543,"To encourage psychological safety, bosses should be receptive of ideas and questions and not simply brush us off when something is raised.",Dept A,encourage psychological safety boss receptive idea question simply brush u something raised,22
3192,"I appreciate the company's commitment to sustainability and making a positive impact on the environment. However, I feel like there could be more emphasis on diversity and inclusion within the company.",Dept A,appreciate company commitment sustainability making positive impact environment however feel like could emphasis diversity inclusion within company,31
4791,"I don't feel like my manager is supportive of my professional development. I've expressed interest in taking on more responsibility and learning new skills, but haven't received any guidance or support in achieving those goals.",Dept A,dont feel like manager supportive professional development ive expressed interest taking responsibility learning new skill havent received guidance support achieving goal,35
2891,"The company's approach to feedback and performance reviews is outdated and unhelpful. I only receive feedback once a year, which makes it difficult to track my progress and improve in my role.",Dept A,company approach feedback performance review outdated unhelpful receive feedback year make difficult track progress improve role,32
3851,Very strong teamwork and appreciation of each other's point of view in my division.,Dept A,strong teamwork appreciation others point view division,14
2937,"The leadership team is incredibly communicative and transparent. They regularly share updates on the company's goals and progress, and are always available to answer questions or address concerns. This has helped me feel more connected to the company's vision and more invested in its success.",Dept A,leadership team incredibly communicative transparent regularly share update company goal progress always available answer question address concern helped feel connected company vision invested success,45
1981,"However, there doesn't seem to be much encouragement to share mistakes (i.e. do after-action reviews).",Dept A,however doesnt seem much encouragement share mistake ie afteraction review,15
8312,I strongly believe that our company culture encourages employees to speak up and share their ideas freely,Dept A,strongly believe company culture encourages employee speak share idea freely,17
1295,"I appreciate that the company encourages employees to voice their opinions and concerns. However, sometimes it feels like these concerns aren't always addressed in a timely manner, which can be frustrating.",Dept A,appreciate company encourages employee voice opinion concern however sometimes feel like concern arent always addressed timely manner frustrating,31
3205,"The company's commitment to professional development is really evident. I've been given numerous opportunities to learn new skills and take on more responsibility, and my manager has been incredibly supportive in helping me achieve my goals. This has been instrumental in my success so far and has motivated me to continue pushing myself.",Dept A,company commitment professional development really evident ive given numerous opportunity learn new skill take responsibility manager incredibly supportive helping achieve goal instrumental success far motivated continue pushing,53
3070,"The company's benefits package is lackluster. Compared to other companies in the industry, the benefits offered here are minimal and don't feel like they adequately compensate me for my hard work.",Dept A,company benefit package lackluster compared company industry benefit offered minimal dont feel like adequately compensate hard work,31
1068,"Still expecting immediate replies to top management, even where issues do not seem to require urgent attention.",Dept A,still expecting immediate reply top management even issue seem require urgent attention,17
1075,"Overall, I am very happy with the pay and rewards system, but I believe there is room for improvement in the area of employee recognition and incentives.",Dept A,overall happy pay reward system believe room improvement area employee recognition incentive,27
4660,"I appreciate the company's commitment to work-life balance, but sometimes it feels like there is a lack of support when it comes to workload management. There can be an expectation that employees take on more work than they can handle, which can lead to burnout and stress. More support from managers and colleagues would help ensure that everyone is able to manage their workload effectively. Additionally, while the option to work from home is available, there can be an expectation that employees work longer hours or be available at all hours. More guidance around work-life balance would be greatly appreciated.",Dept A,appreciate company commitment worklife balance sometimes feel like lack support come workload management expectation employee take work handle lead burnout stress support manager colleague would help ensure everyone able manage workload effectively additionally option work home available expectation employee work longer hour available hour guidance around worklife balance would greatly appreciated,100
4294,"The benefits package here is very competitive. From health insurance to retirement savings, the company offers a comprehensive package that makes me feel valued as an employee. This has been a key factor in my decision to stay with the company long-term.",Dept A,benefit package competitive health insurance retirement saving company offer comprehensive package make feel valued employee key factor decision stay company longterm,42
7639,leaders acknowledging own mistakes and sharing vulnerability help to build psychological safety and trust.,Dept A,leader acknowledging mistake sharing vulnerability help build psychological safety trust,14
9604,Low value meaningless work,Dept A,low value meaningless work,4
4662,"Demonstrating more trust by allowing more flexible working arrangements; for example, allowing staff to WFH on return to office days, should there be a need to do so e.g. HBL; schools examination period.",Dept A,demonstrating trust allowing flexible working arrangement example allowing staff wfh return office day need eg hbl school examination period,33
3401,Leaders provide clear direction by giving suggestions or inputs instead of merely giving vague comments or questions that do not point to anything.,Dept A,leader provide clear direction giving suggestion input instead merely giving vague comment question point anything,23
2479,"The company's approach to feedback and performance reviews is incredibly helpful. My manager provides regular feedback on my work, and we have open and honest conversations about my strengths and areas for improvement. This has helped me grow in my role and feel more invested in the company's success.

I really appreciate the company's commitment to sustainability. Whether it's through reducing our carbon footprint or supporting local community initiatives, it's clear that the company is making a positive impact on the world. This makes me feel proud to work here and motivates me to do my best work.",Dept A,company approach feedback performance review incredibly helpful manager provides regular feedback work open honest conversation strength area improvement helped grow role feel invested company success really appreciate company commitment sustainability whether reducing carbon footprint supporting local community initiative clear company making positive impact world make feel proud work motivates best work,98
8368,Some leaders have displayed empathy when considering and acknowledging the practical challenges faced by officers in their day-to-day work.,Dept A,leader displayed empathy considering acknowledging practical challenge faced officer daytoday work,19
3534,"Relook at benchmarking, investment banks compensation need not be taken out of the equation as these are genuine opportunity pool for our people.",Dept B,relook benchmarking investment bank compensation need taken equation genuine opportunity pool people,23
5687,The open-door policy of the management and their willingness to listen to the employees has created a positive and inclusive working environment.,Dept B,opendoor policy management willingness listen employee created positive inclusive working environment,22
9411,"The company's leadership team is generally effective and transparent, but I feel like there could be more guidance provided around career development. While there are resources available for employees who want to grow within the company, it can be difficult to know where to start or who to approach for guidance. I would like to see more mentorship and coaching opportunities for employees who want to advance their careers. Additionally, while I appreciate the company's commitment to transparency, there are still some decisions that feel opaque to me. More communication around the reasoning behind decisions would help build trust and make employees feel more connected to the company's vision.",Dept B,company leadership team generally effective transparent feel like could guidance provided around career development resource available employee want grow within company difficult know start approach guidance would like see mentorship coaching opportunity employee want advance career additionally appreciate company commitment transparency still decision feel opaque communication around reasoning behind decision would help build trust make employee feel connected company vision,109
1401,"I appreciate the company's commitment to work autonomy and trust in employees, but sometimes it can feel like there is a lack of direction or guidance. More frequent check-ins with managers would help ensure that everyone is on the same page and that expectations are clear. Additionally, it would be helpful to have clearer project goals and deliverables. While the company's",Dept B,appreciate company commitment work autonomy trust employee sometimes feel like lack direction guidance frequent checkins manager would help ensure everyone page expectation clear additionally would helpful clearer project goal deliverable company,61
1398,"The company's culture is generally positive and supportive, but there are still some areas for improvement. I would like to see more emphasis on team building and bonding activities to help foster a stronger sense of camaraderie. Additionally, while there is an emphasis on work autonomy, there can sometimes be a lack of direction or clarity around goals and expectations. More guidance and direction from managers would help ensure that everyone is on the same page and working towards the same goals.",Dept B,company culture generally positive supportive still area improvement would like see emphasis team building bonding activity help foster stronger sense camaraderie additionally emphasis work autonomy sometimes lack direction clarity around goal expectation guidance direction manager would help ensure everyone page working towards goal,82
1073,"I appreciate the company's efforts to foster a diverse and inclusive workplace. It's clear that everyone is valued and respected here, regardless of their background or identity. This has helped me feel more connected to my colleagues and more invested in the company's success.",Dept B,appreciate company effort foster diverse inclusive workplace clear everyone valued respected regardless background identity helped feel connected colleague invested company success,44
5681,"If at an organisational level, senior management finds it difficult to drop or postpone projects or initiatives, then it would be even less realistic with these work expectations for departments to prioritise and reduce workload meaningfully/significantly.",Dept B,organisational level senior management find difficult drop postpone project initiative would even le realistic work expectation department prioritise reduce workload meaningfullysignificantly,36
7762,"Coupled with ever increasing areas of focus and no additional headcount, time becomes more precious, so margins of errors seem to be decreasing",Dept B,coupled ever increasing area focus additional headcount time becomes precious margin error seem decreasing,23
6179,"While the company is committed to transparency, I feel like there are still some areas where more information could be shared. I would like to see more frequent updates on the company's goals and progress.",Dept B,company committed transparency feel like still area information could shared would like see frequent update company goal progress,35
7390,This culture of openness and idea-sharing has not only improved the work atmosphere but also fostered a sense of community and collaboration among employees.,Dept B,culture openness ideasharing improved work atmosphere also fostered sense community collaboration among employee,24
7561,This would help to create a positive and motivated work environment and encourage employees to continue to strive for excellence,Dept C,would help create positive motivated work environment encourage employee continue strive excellence,20
2491,"However, I would suggest that the company consider offering more incentives and bonuses to recognize employees who go above and beyond in their work.",Dept C,however would suggest company consider offering incentive bonus recognize employee go beyond work,24
2918,"The company's benefits package is pretty standard, but I would like to see more investment in professional development opportunities. I think this would help employees feel more valued and invested in the company's success",Dept C,company benefit package pretty standard would like see investment professional development opportunity think would help employee feel valued invested company success,34
2834,"The company's commitment to work autonomy has been instrumental in my success here. I am trusted to complete tasks independently, and have the freedom to approach my work in a way that works best for me. This has helped me feel more empowered and motivated to achieve my goals.",Dept C,company commitment work autonomy instrumental success trusted complete task independently freedom approach work way work best helped feel empowered motivated achieve goal,49
7850,"The work-life balance options here are excellent. Whether I need to take time off for a doctor's appointment or just want to work from home for the day, my manager is always accommodating. This has helped me feel less stressed and more productive in my work.",Dept C,worklife balance option excellent whether need take time doctor appointment want work home day manager always accommodating helped feel le stressed productive work,46
5109,"The company's approach to work-life balance is insufficient. While the option to work from home is available, there's still an expectation that I be available at all hours and work long days. This has made it difficult for me to maintain a healthy work-life balance.",Dept C,company approach worklife balance insufficient option work home available there still expectation available hour work long day made difficult maintain healthy worklife balance,45
2273,"The company's feedback process is helpful, but could be more frequent. I appreciate the feedback I receive during performance reviews, but I think it would be more helpful to receive feedback more regularly throughout the year.",Dept C,company feedback process helpful could frequent appreciate feedback receive performance review think would helpful receive feedback regularly throughout year,36
1523,"I don't feel like I have the resources I need to succeed in my role. Whether it's access to technology or support from colleagues, there are often roadblocks that make it difficult to complete tasks efficiently.",Dept C,dont feel like resource need succeed role whether access technology support colleague often roadblock make difficult complete task efficiently,36
5977,"I feel like there are some communication issues within our team, which can be frustrating at times. However, I appreciate that my manager is always available to answer questions and provide guidance when needed.",Dept C,feel like communication issue within team frustrating time however appreciate manager always available answer question provide guidance needed,34
1472,"I feel like my workload is unreasonable, and I often find myself working overtime or on weekends just to keep up. This has taken a toll on my mental health and overall job satisfaction.",Dept C,feel like workload unreasonable often find working overtime weekend keep taken toll mental health overall job satisfaction,34
8737,"I appreciate the company's efforts to create a psychologically safe work environment, and I generally feel comfortable sharing my thoughts and concerns with my team. However, there are still some team members who dominate conversations and aren't as receptive to others' ideas. This can make it difficult for those who don't feel as comfortable speaking up to feel truly included. Additionally, I sometimes feel like my feedback isn't fully considered or acted upon by the team. While I understand that not all feedback can be implemented, I.E. it can be discouraging to feel like my opinions aren't valued.",Dept C,appreciate company effort create psychologically safe work environment generally feel comfortable sharing thought concern team however still team member dominate conversation arent receptive others idea make difficult dont feel comfortable speaking feel truly included additionally sometimes feel like feedback isnt fully considered acted upon team understand feedback implemented ie discouraging feel like opinion arent valued,98
5011,"The communication within our team is lacking, which makes it difficult to complete projects efficiently. There are often misunderstandings and miscommunications that cause delays and frustration.",Dept C,communication within team lacking make difficult complete project efficiently often misunderstanding miscommunications cause delay frustration,26
5245,"In conclusion, I highly appreciate the company's efforts to promote an open and idea-friendly work environment, and I look forward to continuing to work in such a supportive and empowering atmosphere.",Dept C,conclusion highly appreciate company effort promote open ideafriendly work environment look forward continuing work supportive empowering atmosphere,31
1169,"A lot of process streamlining achieved in the past years e.g. procurement process, risk assessment process, etc.",Dept C,lot process streamlining achieved past year eg procurement process risk assessment process etc,17
2753,"The company's technology infrastructure is generally adequate, but there are still some areas where more investment could be made. For example, the video conferencing capabilities could be improved to make remote work more effective. Additionally, I feel like there could be more training and resources provided for employees who are new to the technology. While I appreciate the company's efforts to provide technology for remote work, more investment in these tools would help make the transition to remote work more seamless",Dept C,company technology infrastructure generally adequate still area investment could made example video conferencing capability could improved make remote work effective additionally feel like could training resource provided employee new technology appreciate company effort provide technology remote work investment tool would help make transition remote work seamless,81
1424,"There's a lack of transparency within the company, which makes it difficult to understand the company's goals and progress. I often feel disconnected from the company's vision and unsure of how my work fits into the bigger picture.",Dept C,there lack transparency within company make difficult understand company goal progress often feel disconnected company vision unsure work fit bigger picture,38
6619,Driving initiatives that promote and protect staff' well-being amidst work challenges.,Dept C,driving initiative promote protect staff wellbeing amidst work challenge,11
8533,I am very satisfied with the pay and rewards system in the company.,Dept C,satisfied pay reward system company,13
2438,"I appreciate the company's commitment to diversity and inclusion, and I have seen efforts to create a more diverse workforce. However, there is still a lack of representation at the leadership level, which can make it difficult for employees from underrepresented groups to feel truly valued and respected. While I think the company's recruitment policies are effective, it will be important to continue investing in leadership training for underrepresented groups to ensure that everyone has a chance to succeed. Additionally, there could be more emphasis on cultural competence training for all employees to help foster a more inclusive workplace culture.",Dept C,appreciate company commitment diversity inclusion seen effort create diverse workforce however still lack representation leadership level make difficult employee underrepresented group feel truly valued respected think company recruitment policy effective important continue investing leadership training underrepresented group ensure everyone chance succeed additionally could emphasis cultural competence training employee help foster inclusive workplace culture,100
